headline,url,subhead,byline,premium,article_type,img_url
My life as a Russian exile in Paris: 'You can't fight French bureaucracy',https://www.lemonde.fr/en/summer-reads/article/2026/07/23/my-life-as-a-russian-exile-in-paris-you-can-t-fight-french-bureaucracy_6755746_183.html,"'A Russian in Paris' (1/6). Journalist Elizaveta Osetinskaya, who came to France in 2022 because of her opposition to the war in Ukraine, describes the difficulties she has faced with the prefecture while barely speaking the language.",,Subscribers only,,https://img.lemde.fr/2026/07/22/296/0/1850/1233/400/266/75/0/eb751a9_upload-1-ct68mxdtxy5i-russieok.jpg
United States announces civilian nuclear deal with Saudi Arabia,https://www.lemonde.fr/en/international/article/2026/07/22/us-announces-nuclear-cooperation-pact-with-saudi-arabia_6755741_4.html,,,,,https://img.lemde.fr/2026/07/17/0/0/5214/3476/398/265/75/0/e663f82_ftp-1-jtwzqoz5johc-094743a02e2e4416a74d0f984cdc7768-0-06c2bc5bdcb543a19c499b53c9370ec3.jpg
How Bernard Arnault works to keep his media outlets in line,https://www.lemonde.fr/en/summer-reads/article/2026/07/22/how-bernard-arnault-works-to-keep-his-media-outlets-in-line_6755737_183.html,,,Subscribers only,,https://img.lemde.fr/2026/07/16/222/0/2302/1534/398/265/75/0/3ac23b4_upload-1-demzmonl3djd-000-92ky3yf.jpg
US House passes record $1.15 trillion defense bill,https://www.lemonde.fr/en/international/article/2026/07/23/us-house-approves-95-billion-budget-plan-with-iran-war-funding_6755742_4.html,"The bill, which must still pass the Senate, provides approximately $250 billion more than the 2026 NDAA, including a 5-7% pay raise for those in the service. 'This legislation provides our brave servicemembers with an overdue pay raise, strengthens our nuclear deterrence and missile defense,' House Speaker Mike Johnson said on Wednesday.",,,,https://img.lemde.fr/2024/04/20/0/0/6000/4000/398/265/75/0/feb2cc8_4b252241268448ca8f172ae023d769a9-0-fc27a215c2154e39bb5f485906eb2314.jpg
"After exoplanets, the hunt for 'exomoons' begins",https://www.lemonde.fr/en/science/article/2026/07/23/after-exoplanets-the-hunt-for-exomoons-begins_6755744_10.html,"An international team has identified an object orbiting a brown dwarf, which itself revolves around a star twice as small as our Sun. The findings were published Wednesday in the journal 'Nature.'",,Subscribers only,,https://img.lemde.fr/2026/07/22/1689/0/2516/1677/398/265/75/0/87e76d9_upload-1-w2orjw18141q-artist-s-impression-of-the-cd-35-2722-system.jpeg
Looking back on Balenciaga's apocalyptic runway show in March 2020,https://www.lemonde.fr/en/summer-reads/article/2026/07/23/balenciaga-s-apocalyptic-runway-show-in-march-2020_6755745_183.html,"'Behind the scenes' (1/6). Runway shows are pivotal moments for fashion houses, often providing an opportunity for particularly spectacular productions. In March 2020, creative director Demna devised a hellish presentation for Balenciaga.",,Subscribers only,,https://img.lemde.fr/2026/07/06/336/0/4032/2688/398/265/75/0/997b234_upload-1-prvqag5xrq4p-773-decor-002.jpeg
Mauritius business scion Arnaud Lagesse bets on Africa's booming consumer market,https://www.lemonde.fr/en/international/article/2026/07/23/mauritius-business-scion-arnaud-lagesse-bets-on-africa-s-booming-consumer-market_6755748_4.html,"'African Fortunes'. Arnaud Lagesse, the heir to one of Mauritius's prominent families of French origin, doubled the size of his conglomerate – now with 256 subsidiaries – in three years. He is gambling on expanding his empire outside of the island country... and across the African continent.",Marion Douet,Subscribers only,Profile,https://img.lemde.fr/2026/07/11/166/0/3543/2362/664/442/75/0/f9f1d3d_upload-1-gsjta0kq9u2g-monde-serie-fortunesafricaines-1-300dpifond-retouche.jpg
"Wildfires ravage parts of southern France, Italy and Spain",https://www.lemonde.fr/en/international/article/2026/07/23/wildfires-ravage-parts-of-southern-france-italy-and-spain_6755743_4.html,,,,,https://img.lemde.fr/2026/07/22/0/0/5953/3968/198/132/95/0/2a8e27b_ftp-1-h5vsukwwn51f-2026-07-22t233911z-1191202656-rc2ajma2cno7-rtrmadp-3-europe-weather-france-wildfire.JPG
Widespread drying of soil and rivers in France raises alarm among hydrologists,https://www.lemonde.fr/en/environment/article/2026/07/23/widespread-drying-of-soil-and-rivers-in-france-raises-alarm-among-hydrologists_6755747_114.html,,,Subscribers only,,https://img.lemde.fr/2026/07/22/1/0/7837/5224/198/132/95/0/e56af86_upload-1-qxztxdtpyvly-000-c2ny4t6.jpg
US trial of Venezuela's Maduro set for June 2027,https://www.lemonde.fr/en/international/article/2026/07/22/us-trial-of-venezuela-s-maduro-set-for-june-2027_6755740_4.html,,,,,https://img.lemde.fr/2026/07/22/125/0/3000/2000/198/132/95/0/4078008_ftp-1-6nfrub2vtix6-2026-07-22t183708z-1546256284-rc2zimabbfk3-rtrmadp-3-usa-venezuela-maduro.JPG
"France records over 5,700 excess deaths during June heatwave",https://www.lemonde.fr/en/france/article/2026/07/22/france-records-over-5-700-excess-deaths-during-june-heatwave_6755732_7.html,,,,,https://img.lemde.fr/2026/07/20/1/0/7490/4993/198/132/95/0/62b4468_ftp-1-3obt0n6c37oq-5667821-01-06.jpg
Kremlin propagandist Xenia Fedorova escapes EU sanctions targeting Russian figures,https://www.lemonde.fr/en/international/article/2026/07/22/kremlin-propagandist-xenia-fedorova-escapes-eu-sanctions-targeting-russian-figures_6755722_4.html,,,Subscribers only,,
European Commission withdraws €2 million grant from Venice Biennale over Russian presence,https://www.lemonde.fr/en/culture/article/2026/07/22/european-commission-withdraws-2-million-grant-from-venice-biennale-over-russian-presence_6755734_30.html,,,Subscribers only,,
"Zelensky forced to dismiss Oleksandr Syrsky, Ukraine's armed forces chief",https://www.lemonde.fr/en/international/article/2026/07/22/zelensky-forced-to-dismiss-oleksandr-syrsky-ukraine-s-armed-forces-chief_6755725_4.html,,,Subscribers only,,
French environment minister backtracks on resignation over 'urgency' to act on climate,https://www.lemonde.fr/en/france/article/2026/07/22/french-environment-minister-backtracks-on-resignation-over-urgency-to-act-on-climate_6755719_7.html,,,,,
"Sleeping Beauty syndrome: 'For a week, I slept 15 to 20 hours out of every 24'",https://www.lemonde.fr/en/summer-reads/article/2026/07/22/sleeping-beauty-syndrome-for-a-week-i-slept-15-to-20-hours-out-of-every-24_6755706_183.html,,,Subscribers only,,
Cédric Jubillar admitted to killing his wife after five years of denial. Here is what he told the authorities,https://www.lemonde.fr/en/france/article/2026/07/22/cedric-jubillar-admitted-to-killing-his-wife-after-five-years-of-denial-here-is-what-he-told-the-authorities_6755716_7.html,,,Subscribers only,,
"Despite living 'like a walking dead man,' South Africa's Thabiso Zulu continues crusade against ANC corruption",https://www.lemonde.fr/en/le-monde-africa/article/2026/07/22/south-africa-despite-living-like-a-walking-dead-man-thabiso-zulu-continues-crusade-against-anc-corruption_6755723_124.html,,,Subscribers only,,
France's must-see art exhibitions this summer,https://www.lemonde.fr/en/culture/article/2026/07/19/france-s-must-see-art-exhibitions-this-summer_6755615_30.html,,,Subscribers only,,
"Friterie des Nations, a local institution at the Calais Beach",https://www.lemonde.fr/en/summer-reads/article/2026/07/22/friterie-des-nations-a-local-institution-at-the-calais-beach_6755739_183.html,"'Gourmet kiosks' (1/6). Across France, small kiosks serving local specialties are a favorite stop for holidaymakers. In Calais, northern France, Pascal Carré and his daughter Loranne serve fries that are crisp on the outside and soft on the inside.",Léo Bourdin,Subscribers only,Series,https://img.lemde.fr/2026/07/03/171/0/4096/2730/664/442/75/0/37eb2ea_upload-1-flqroqora4vc-img20260528120804.jpg
"How social media bans for young users, now in effect in France, have spread worldwide",https://www.lemonde.fr/en/pixels/article/2026/07/22/how-social-media-bans-for-young-users-now-in-effect-in-france-have-spread-worldwide_6755718_13.html,France has decided to ban those under 15 from major platforms such as Instagram and TikTok. The country is following a global trend that has gained momentum in recent years.,Florian Reynaud,Subscribers only,In Depth,https://img.lemde.fr/2026/07/21/0/0/3000/2000/664/442/75/0/787e78b_upload-1-tiqvpb9bqo0v-illustration-sans-titre-35-1.jpg
"New monkey species identified in Lomami National Park, Democratic Republic of Congo",https://www.lemonde.fr/en/environment/article/2026/07/22/new-monkey-species-identified-in-lomami-national-park-democratic-republic-of-congo_6755710_114.html,"First photographed in 2008, this small colobus monkey with pink-orange lips has now been officially described by an international team of researchers – and may be immediately classified as 'endangered.'",Pierre Boitel,Subscribers only,News,https://img.lemde.fr/2026/07/21/0/0/3999/2666/664/442/75/0/7f22d4f_upload-1-z6ynajiubly7-c-congoensis-frankfurt-zoological-society.jpg
France's agriculture law puts government in a bind,https://www.lemonde.fr/en/opinion/article/2026/07/22/france-s-agriculture-law-puts-government-in-a-bind_6755726_23.html,,Le Monde,,Editorial,
'Stopping AI because it carries risks? That would be like banning cars because they cause accidents',https://www.lemonde.fr/en/opinion/article/2026/07/22/stopping-ai-because-it-carries-risks-that-would-be-like-banning-cars-because-they-cause-accidents_6755705_23.html,,Eric Hazan  and  Olivier Sibony,Subscribe,Op-Ed,
"'We are trapped in a climate dystopia, a black comedy scenario, where the grotesque rivals the Orwellian farce'",https://www.lemonde.fr/en/opinion/article/2026/07/18/we-are-trapped-in-a-climate-dystopia-a-black-comedy-scenario-where-the-grotesque-rivals-the-orwellian-farce_6755609_23.html,,Stéphane Foucart,Subscribe,Column,
